<?xml version="1.0" encoding="UTF-8"?>
<!DOCTYPE employee SYSTEM "employee.dtd">

<employee>
        <id>e01</id>
        <name>Name 1</name>
        <address>
            <street>Street 1</street>
            <ward>Ward 1</ward>
            <district>District 1</district>
        </address>
        <phone>123456</phone>
        <phone>234567</phone>
        <phone>087543</phone>
        <email>name1@gmail.com</email>
        <email>name1@hotmail.com</email>
        <website>http://name1.com</website>
        <dob place="Place 1" format="yyyy-mm-dd">1993-08-13</dob>
    
 </employee>